date_idx,num_tweets,text
160,8,see you tomorrow wisconsin ! 'trump spurs small business optimism in milwaukee area'https : t . co juxho3oqjotrump approval hits 50 https : t . co vjzkgtyqb9rt drudge report : trump approval hits 50 https : t . co trux3wzr3uthe super liberal democrat in the georgia congressioal race tomorrow wants to protect criminals allow illegal immigration and raise taxes ! the fake media not real media has gotten even worse since the election . every story is badly slanted . we have to hold them to the truth ! a great book for your reading enjoyment : reasons to vote for democrats by michael j . knowles . the first 90 days of my presidency has exposed the total failure of the last eight years of foreign policy ! so true . foxandfriendsthe recent kansas election congress was a really big media event until the republicans won . now they play the same game with georgia bad !
161,7,buyamericanhireamerican watch https : t . co auqycrgeyn https : t . co rf9aivvb7gjust learned that jon ossoff who is running for congress in georgia doesn't even live in the district . republicans get out and vote ! republicans must get out today and vote in georgia 6 . force runoff and easy win ! dem ossoff will raise your taxes very bad on crime amp ; 2nd a . democrat jon ossoff would be a disaster in congress . very weak on crime and illegal immigration bad for jobs and wants higher taxes . say noi will be interviewed on foxandfriends by ainsleyearhardt starting at 6 : 00 a . m . enjoy ! the weak illegal immigration policies of the obama admin . allowed bad ms 13 gangs to form in cities across u . s . we are removing them fast ! with eleven republican candidates running in georgia on tuesday for congress a runoff will be a win . vote r for lower taxes amp ; safety !
162,4,today i signed the veterans our heroes choice program extension amp ; improvement act the whitehouse . s544 watch https : t . co 0smv4sprmf buyamericanhireamerican https : t . co jpexqtvr1edems failed in kansas and are now failing in georgia . great job karen handel ! it is now hollywood vs . georgia on june 20th . despite major outside money fake media support and eleven republican candidates big r win with runoff in georgia . glad to be of help !
163,4,a great honor to host pm paolo gentiloni of italy at the white house this afternoon ! icymi joint press conference https : t . co ljavezjv1fwe're going to use american steel we're going to use american labor we are going to come first in all deals . https : t . co qyjwx9k4yyfailing nytimes which has been calling me wrong for two years just got caught in a big lie concerning new england patriots visit to w . h . a great honor to host the superbowl champion new england patriots at the white house today . congratulations ! https : t . co tq5xepaixn
164,5,welcome home aya ! godblesstheusa https : t . co cr4i8dvuncchina is very much the economic lifeline to north korea so while nothing is easy if they want to solve the north korean problem they willno matter how much i accomplish during the ridiculous standard of the first 100 days amp ; it has been a lot including s . c . media will kill ! another terrorist attack in paris . the people of france will not take much more of this . will have a big effect on presidential election ! rt foxandfriends : nyt editor apologizes for misleading tweet about new england patriots ' visit to the white house via foxfriendsfirst h
165,10,i am committed to keeping our air and water clean but always remember that economic growth enhances environmental protection . jobs matter ! today on earth day we celebrate our beautiful forests lakes and land . we stand committed to preserving the natural beauty of our nation . big tax reform and tax reduction will be announced next wednesday . next saturday night i will be holding a big rally in pennsylvania . look forward to it ! getting ready to visit walter reed medical center with melania . looking forward to seeing our bravest and greatest americans ! rt foxandfriends : israeli pm netanyahu praises u . s . policy changes during meeting with defense . sec mattis https : t . co v2c9oaq3uyrt foxandfriends : chicago approves new plan to hide illegal immigrants from the feds plus give them access to city services https : t . co after 5 sb victories since 2002 it was my honor to give bob kraft coach belichick and the players their first to https : t . co uzpkjqogzy'presidential executive order on identifying and reducing tax regulatory burdens ' executive order : https : t . co dpe6hdzlatrt scavino45 : . potus realdonaldtrump ivankatrump jared kushner amp ; dina powell in the oval office today w aya amp ; her brother basel . w
166,7,. . . popular vote . abc news washington post poll wrong big on election said almost all stand by their vote on me amp ; 53 said strong leader . new polls out today are very good considering that much of the media is fake and almost always negative . would still beat hillary in . . . . . eventually but at a later date so we can get started early mexico will be paying in some form for the badly needed border wall . the democrats don't want money from budget going to border wall despite the fact that it will stop drugs and very bad ms 13 gang members . obamacare is in serious trouble . the dems need big money to keep it going otherwise it dies far sooner than anyone would have thought . thank you lake worth florida . foxandfriendsvery interesting election currently taking place in france .
167,7,today i signed the holocaust remembrance proclamation : https : t . co 762sqgdlmv icymi my statement last night at https : t . co vrqqfdi8enif our healthcare plan is approved you will see real healthcare and premiums will start tumbling down . obamacare is in a death spiral ! join me in congratulating nasa 's astropeggy by using the hashtag congratspeggy ! earlier today : https : t . co audjgxxit4 . . . . the wall is not built which it will be the drug situation will never be fixed the way it should be ! buildthewall congratspeggy ! https : t . co e1q36nkt8gthe wall is a very important tool in stopping drugs from pouring into our country and poisoning our youth and many others ! ifthe two fake news polls released yesterday abc amp ; nbc while containing some very positive info were totally wrong in general e . watch !
168,5,'presidential executive order on promoting agriculture and rural prosperity in america'executive order : https : t . co lvmjz9ax0uremarks at the united states holocaust memorial museum 's national days of remembrance . full remarks : https : t . co bjbi6ztgo7don't let the fake media tell you that i have changed my position on the wall . it will get built and help stop drugs human trafficking etc . canada has made business for our dairy farmers in wisconsin and other border states very difficult . we will not stand for this . watch ! proud of ivankatrump for her leadership on these important issues . looking forward to hearing her speak at the w20 ! https : t . co e6uajrm8zp
169,9,democrats are trying to bail out insurance companies from disastrous obamacare and puerto rico with your tax dollars . sad ! a great great honor to welcome amp ; recognize the national teacher of the year as well as the teacher of the year fro https : t . co pugl7rdovxtoday i signed an executive order on enforcing statutory prohibitions on federal control of education . eo : https : t . co yyaffqncbctoday i signed an executive order the u . s . dept . of interior : 'review of designations under the antiquities act https : t . co eq6jdzmqtyhappy birthday to our flotus melania ! https : t . co ryyp51mxdq https : t . co np7kyhglsvthe u . s . recorded its slowest economic growth in five years 2016 . gdp up only 1 . 6 . trade deficits hurt the economy very badly . . . . the ninth circuit which has a terrible record of being overturned close to 80 . they used to call this judge shopping ! messy system . out of our very big country with many choices does everyone notice that both the ban case and now the sanctuary case is brought in . . . first the ninth circuit rules against the ban amp ; now it hits again on sanctuary cities both ridiculous rulings . see you in the supreme court !
170,12,today i signed an executive order on improving accountability and whistleblower protection at the deptvetaffairs : https : t . co uq6vncyhljpresidential memorandum for the commercegov secretaryross re : aluminum imports and threats to national security : https : t . co gnkovz9gto . flotus melania and i were honored to welcome argentina president mauriciomacri and first lady juliana awada to t https : t . co gr3epznu1has families prepare for summer vacations in our national parks democrats threaten to close them and shut down the government . terrible ! democrats used to support border security now they want illegals to pour through our borders . democrats jeopardizing the safety of our troops to bail out their donors from insurance companies . it is time to put americafirst what 's more important ? rebuilding our military or bailing out insurance companies ? ask the democrats . i promise to rebuild our military and secure our border . democrats want to shut down the government . politics ! i want to help our miners while the democrats are blocking their healthcare . the democrats want to shut government if we don't bail out puerto rico and give billions to their insurance companies for ocare failure . no ! . . . subject to the fact that if we do not reach a fair deal for all we will then terminate nafta . relationships are good deal very possible ! i received calls from the president of mexico and the prime minister of canada asking to renegotiate nafta rather than terminate . i agreed . .
171,4,north korea disrespected the wishes of china amp ; its highly respected president when it launched though unsuccessfully a missile today . bad ! i will be interviewed by marthamaccallum on foxnews tonight at 7pm . enjoy ! we are making tremendous progress with the v . a . there has never been so much done so quickly and we have just started . we love our vets ! rt foxandfriends : former president obama 's 400k wall street speech stuns liberal base ; sen . warren saying she was troubled by that http
172,5,rt charliekirk11 : 100 days ago a new message leader amp ; movement took the oval office ! a government for the people by the people . this is mainstream fake media refuses to state our long list of achievements including 28 legislative signings strong borders amp ; great optimism ! looking forward to rally in the great state of pennsylvania tonight at 7 : 30 . big crowd big energy ! . loudobbs just stated that president trump 's successes are unmatched in recent presidential history thank you lou ! rt foxnation : . tuckercarlson : dems don't really believe trump is a pawn of russia that 's just their political tool https : t . co k
173,5,. . . healthcare plan is on its way . will have much lower premiums amp ; deductibles while at the same time taking care of pre existing conditions ! you can't compare anything to obamacare because obamacare is dead . dems want billions to go to insurance companies to bail out donors . . . . newthe democrats without a leader have become the party of obstruction . they are only interested in themselves and not in what 's best for u . s . big excitement last night in the great state of pennsylvania ! fantastic crowd and people . make america great again ! i will be interviewed on facethenation this morning at 10 : 00 a . m . have a great day !
174,2,icymi on saturday i signed two eo 's to help keep jobs amp ; wealth in our country . eo1 : https : t . co xjggnjaipi eo2 : https : t . co 2ieten4svlthis month we celebrate the contributions of asian americans amp ; pacific islanders that enrich our nation . https : t . co reji9ahoay
175,4,congratulations to the winners of the commander in chief 's trophy the great air force falcons ! watch : https : t . co hyxxfcfauheither elect more republican senators in 2018 or change the rules now to 51 . our country needs a good shutdown in september to fix mess ! the reason for the plan negotiated between the republicans and democrats is that we need 60 votes in the senate which are not there ! we . . . . president andrew jackson who died 16 years before the civil war started saw it coming and was angry . would never have let it happen !
176,4,an honor to host president mahmoud abbas at the wh today . hopefully something terrific could come out it between th https : t . co eyhlfzbkhnit was an honor to stop by a schoolchoice event hosted by vp pence and usedgov secretary betsydevosed at the https : t . co b8vxvsynha . . . trump russia story was an excuse used by the democrats as justification for losing the election . perhaps trump just ran a great campaign ? fbi director comey was the best thing that ever happened to hillary clinton in that he gave her a free pass for many bad deeds ! the phony . . .
177,10,if victorious republicans will be having a big press conference at the beautiful rose garden of the white house immediately after vote ! insurance companies are fleeing obamacare it is dead . our healthcare plan will lower premiums amp ; deductibles and be great healthcare ! i am watching the democrats trying to defend the you can keep you doctor you can keep your plan amp ; premiums will go down obamacare lie . beautiful evening with religious leaders here at the wh last night . join us now for a nationaldayofprayer live : https : t . co b8j1twzjuvdeath spiral ! 'aetna will exit obamacare markets in va in 2018 citing expected losses on indv plans this year'https : t . co 5ynzditf8rrt foxandfriends : president trump to sign an executive order on religious liberty today the national day of prayer kevincorke https : congratulations to foxandfriends on its unbelievable ratings hike . the fake news media is officially out of control . they will do or say anything in order to get attention never been a time like this ! . . . allegations of unmasking trump transition officials . not good ! susan rice the former national security advisor to president obama is refusing to testify before a senate subcommittee next week on . . . . .
178,10,great jobs report today it is all beginning to work ! why is it that the fake news rarely reports ocare is on its last legs and that insurance companies are fleeing for their lives ? it 's dead ! wowthe fake news media did everything in its power to make the republican healthcare victory look as bad as possible . far better than ocare ! weeklyaddress https : t . co 4qckkpbtcrjobs jobs jobs ! https : t . co ur0eetsenoof course the australians have better healthcare than we do everybody does . obamacare is dead ! but our healthcare will soon be great . rather than causing a big disruption in n . y . c . i will be working out of my home in bedminster n . j . this weekend . also saves country money ! big win in the house very exciting ! but when everything comes together with the inclusion of phase 2 we will have truly great healthcare ! an honor to welcome pm of australia turnbullmalcolm to america amp ; join him in marking the 75th anniversary of the https : t . co fomuec7eaeit was a great day for the united states of america ! this is a great plan that is a repeal amp ; replace of obamacare . https : t . co 0tnmln55lm
179,1,the reason i am staying in bedminster n . j . a beautiful community is that staying in nyc is much more expensive and disruptive . meetings !
180,6,rexnord of indiana made a deal during the obama administration to move to mexico . fired their employees . tax product big that 's sold in u . s . congratulations to emmanuel macron on his big win today as the next president of france . i look very much forward to working with him ! republican senators will not let the american people down ! obamacare premiums and deductibles are way up it was a lie and it is dead ! rt brunelldonald : i thought about jobs that went overseas failing schools open borders not my skin color when i voted realdonaldtrump ! i rt foxnews : . potus : i'm not against the media . i'm against the fake media . cashinin https : t . co f7mbij7ivlwhen will the fake media ask about the dems dealings with russia amp ; why the dnc wouldn't allow the fbi to check their server or investigate ?
181,10,biggest story today between clapper amp ; yates is on surveillance . why doesn't the media report on this ? fakenews ! the russia trump collusion story is a total hoax when will this taxpayer funded charade end ? sally yates made the fake media extremely unhappy today she said nothing but old news ! director clapper reiterated what everybody including the fake media already knows there is no evidence of collusion w russia and trump . honored to welcome georgia prime minister giorgi kvirikashvili to the whitehouse today with vp mike pence . https : t . co ohxxgtntwbask sally yates under oath if she knows how classified information got into the newspapers soon after she explained it to w . h . counsel . ask sally yates under oath if she knows how classified information got into the newspapers soon after she explained it to w . h . council . general flynn was given the highest security clearance by the obama administration but the fake news seldom likes talking about that . congratulations to pga johndaly on his big win yesterday . john is a great guy who never gave up and now a winner again ! rt israelipm : pm benjamin netanyahu at weekly cabinet meeting : in two weeks israel will host potus trump on his first trip as president
182,2,'manufacturing openings hires rise to highest levels of the recovery'https : t . co txfzdyyioeit was an honor to welcome the teachers of the year to the wh last month . today we honor and thank all teachers ! https : t . co saujfizcwr
183,11,dems have been complaining for months amp ; months about dir . comey . now that he has been fired they pretend to be aggrieved . phony hypocrites ! the roger stone report on cnn is false fake news . have not spoken to roger in a long time had nothing to do with my decision . caught he cried like a baby and begged for forgiveness . . . and now he is judge amp ; jury . he should be the one who is investigated for his acts . years as a pol in connecticut blumenthal would talk of his great bravery and conquests in vietnam except he was never there . when . . . . watching senator richard blumenthal speak of comey is a joke . richie devised one of the greatest military frauds in u . s . history . for . . . . rt drudge report : 10 scandals on director's watch . . . https : t . co dngy08wtbpcomey lost the confidence of almost everyone in washington republican and democrat alike . when things calm down they will be thanking me ! rt drudge report : mexico 2nd deadliest country ; tops afghan iraq . . . https : t . co i4ftsplihvjames comey will be replaced by someone who will do a far better job bringing back the spirit and prestige of the fbi . the democrats have said some of the worst things about james comey including the fact that he should be fired but now they play so sad ! cryin ' chuck schumer stated recently i do not have confidence in him james comey any longer . then acts so indignant . draintheswamp
184,6,yesterday on the same day i had meetings with russian foreign minister sergei lavrov and the fm of ukraine pavlo https : t . co hm4u54dcqorussia must be laughing up their sleeves watching as the u . s . tears itself apart over a democrat excuse for losing the election . we finally agree on something rosie . https : t . co bsp5f3pgbz'presidential executive order on the establishment of presidential advisory commission on election integrity ' https : t . co kvg8r7qzs5'presidential executive order on strengthening the cybersecurity of federal networks and critical infrastructure ' https : t . co kqdbvxpekkthe democrats should be ashamed . this is a disgrace ! draintheswamp https : t . co ufbkeecm2v
185,9,today i welcomed the victory christian center school . good luck the team america rocketry challenge ! tarc watch https : t . co wfrrsk2wuotoday flotus hosted a military mother 's day event in the east room of the wh . it was an honor to stop by say hel https : t . co wnvb0pyoefchina just agreed that the u . s . will be allowed to sell beef and other major products into china once again . this is real news ! when james clapper himself and virtually everyone else with knowledge of the witch hunt says there is no collusion when does it end ? james comey better hope that there are no tapes of our conversations before he starts leaking to the press ! . . . maybe the best thing to do would be to cancel all future press briefings and hand out written responses for the sake of accuracy ? ? ? as a very active president with lots of things happening it is not possible for my surrogates to stand at podium with perfect accuracy ! . . . . the fake media is working overtime today ! again the story that there was collusion between the russians amp ; trump campaign was fabricated by dems as an excuse for losing the election .
186,4,i was thrilled to be back libertyu . congratulations to the class of 2017 ! this is your day and you've earned it . https : t . co 87ryopwbiywill be interviewed by judgejeanine on foxnews at 9 : 00 p . m . saturday night . enjoy ! we weeklyaddress https : t . co ut4k4fh88y https : t . co 1iw7tvvnch
187,1,wishing flotus melania and all of the great mothers out there a wonderful day ahead with family and friends ! happy mothersday
188,1,today i delivered remarks at the 36th annual national peace officers ' memorial service . nationalpoliceweekwatch https : t . co 3eiovdctqb
189,6,it was a great honor to welcome the president of turkey recep tayyip erdo an to the whitehouse today ! https : t . co 4bwjocgnnv'u . s . industrial production surged in april ' https : t . co s0z4seirhii have been asking director comey amp ; others from the beginning of my administration to find the leakers in the intelligence community . . . . . . . . to terrorism and airline flight safety . humanitarian reasons plus i want russia to greatly step up their fight against isis amp ; terrorism . as president i wanted to share with russia at an openly scheduled w . h . meeting which i have the absolute right to do facts pertaining . . . . peaceofficersmemorialday and policeweek proclamation : https : t . co o4ixvfzuhw https : t . co umj6hklx4a
190,1,it was my great honor to deliver the cgacommencement17 at the uscgacademy . congratulations to the class of 2017 ! https : t . co ehqanqxisy
191,4,a great honor to welcome president juan manuel santos of colombia to the white house today ! joint press conf https : t . co uwfiqedsaywith all of the illegal acts that took place in the clinton campaign amp ; obama administration there was never a special counsel appointed ! this is the single greatest witch hunt of a politician in american history ! with all of the illegal acts that took place in the clinton campaign amp ; obama administration there was never a special councel appointed !
192,3,weeklyaddress https : t . co uyehgch4hl https : t . co hiqofuc5cygetting ready for my big foreign trip . will be strongly protecting american interests that 's what i like to do ! president donald j . trump proclaims 5 14 2017 through 5 20 2017 as policeweekproclamation https : t . co eccsgaizwu
193,2,thank you to the brave servicemen amp ; women who have served and continue to serve the united states our true heroes https : t . co ztv9f639xmgreat to be in riyadh saudi arabia . looking forward to the afternoon and evening ahead . potusabroad https : t . co jjora0kfyr
194,3,riyadhsummit potusabroad https : t . co wddeoiv6osspeech transcript at arab islamic american summit https : t . co euwxjxjxbereplay https : t . co vtmlsqcixx riyadhsummit potusabroadrt flotus : i had a wonderful time with the students at the american international school riyadh today . saudiaarabia https : t . co avzvv0w
195,2,prime minister netanyahu and presidentruvi on behalf of flotus melania and myself thank you for the invitation https : t . co z5ycparv6trt netanyahu : ever stronger https : t . co ecf5p4hjfz
196,4,all civilized nations must join together to protect human life and the sacred right of our citizens to live in safety and in peace . israel saudi arabia and the middle east were great . trying hard for peace . doing well . heading to vatican amp ; pope then g7 and nato . thank you for such a wonderful and unforgettable visit prime minister netanyahu and presidentruvi . we stand in absolute solidarity with the people of the united kingdom . https : t . co x6fuuxxyxe
197,2,thank you for the warm welcome to brussels belgium this afternoon ! https : t . co 1avysamed4honor of a lifetime to meet his holiness pope francis . i leave the vatican more determined than ever to pursue peac https : t . co jhe7sroaxd
198,4,just arrived in taormina with flotus melania . g7summit usa https : t . co l7axolkbikthank you for your support . together we will make america safe and great again ! potusabroad usa https : t . co 42vcwr5gkatoday 's ceremony is a day for both remembrance and resolve . natomeeting nato https : t . co ynzv3btekbrt flotus : thank u to queen fabiola university hospital ! enjoyed creating paper flowers with amazing patients amp ; getting a tour . brussels
199,4,on behalf of flotus melania and myself thank you for a wonderful dinner and evening president sergio mattarella . https : t . co ehvwgjkrryterrorists are engaged in a war against civilization it is up to all who value life to confront amp ; defeat this evil https : t . co haeuvcif6igetting ready to engage g7 leaders on many issues including economic growth terrorism and security . just arrived in italy for the g7 . trip has been very successful . we made and saved the usa many billions of dollars and millions of jobs .
