date_idx,num_tweets,text
299,13,the united states is considering in addition to other options stopping all trade with any country doing business with north korea . i will be meeting general kelly general mattis and other military leaders at the white house to discuss north korea . thank you . south korea is finding as i have told them that their talk of appeasement with north korea will not work they only understand one thing ! . . north korea is a rogue nation which has become a great threat and embarrassment to china which is trying to help but with little success . north korea has conducted a major nuclear test . their words and actions continue to be very hostile and dangerous to the united states . . . . . so much spirit in la ! thank you to all of our hereos who saved many lives . an honor to spend time w nationalguard leos amp ; the cajunnavy ! https : t . co 7petsl6rkfremember sunday is national prayer day by presidential proclamation ! just got back to the white house from the great states of texas and louisiana where things are going well . such cooperation amp ; coordination ! the manufacturing index rose to 59 the highest level since early 2011 and we can do much better ! rt team trump45 : realdonaldtrump https : t . co o1x6x2qqdmrt columbiabugle : realdonaldtrump flotus president trump greeting families affected by hurricane harvey . texasstrong https : t . co 5ga3d rt columbiabugle : realdonaldtrump love our flotus ! https : t . co 6lt9mlaj86together we will prevail in the great state of texas . we love you ! god bless texas amp ; god bless the usa https : t . co 1rzmeenqib
300,1,we are building our future with american hands american labor american iron aluminum and steel . happy laborday ! https : t . co lyvtnfq5io
301,6,i look forward to working w d 's r 's in congress to address immigration reform in a way that puts hardworking citizens of our country 1st . rt the trump train : realdonaldtrump make no mistake we are going to put the interest of american citizens first ! the forgotten men amp ; w i am allowing japan amp ; south korea to buy a substantially increased amount of highly sophisticated military equipment from the united states . rt danscavino : 'trump as commander in chief making the hard decisions ' by ltg ret kellogg a highly decorated vietnam war vet : https : congress get ready to do your job daca ! big week coming up !
302,8,wonderful to be in north dakota with the incredible hardworking men amp ; women the andeavor refinery . full remarks : https : t . co uxbpyeerum https : t . co fv9r9gjxdsjust spoke w governors rick scott of florida kenneth mapp of the u . s . virgin islands amp ; ricardo rossell of puerto rico . we are w you all ! https : t . co k92cslgkfa'president donald j . trump approves emergency declarations ' https : t . co xshsynkvup https : t . co ubbsfohmm7 https : t . co xwofp9z9ir https : t . co qojom54gy8rt vp : . potus is committed to the health amp ; well being of the us people amp ; we are confident dr . jerome adams will succeed as our new surgeo hurricane looks like largest ever recorded in the atlantic ! watching hurricane closely . my team which has done and is doing such a good job in texas is already in florida . no rest for the weary ! will be going to north dakota today to discuss tax reform and tax cuts . we are the highest taxed nation in the world that will change . congress now has 6 months to legalize daca something the obama administration was unable to do . if they can't i will revisit this issue !
303,12,during my trip to saudi arabia i spoke to the leaders of more than 50 arab amp ; muslim nations about the need to confront our shared enemies . . https : t . co 8oeaqfiex8together we will show the world that the forces of destruction and extremism are no match for the blessings of prosperity and peace ! https : t . co al6in83ewkwelcome to the whitehouse amir sabah al ahmed al jaber al sabah of kuwait ! joint press conference coming up soon : https : t . co 8t4nyzlp4y https : t . co lfra4aatamfor all of those daca that are concerned about your status during the 6 month period you have nothing to worry about no action ! rt gop : . ivankatrump : this administration is committed to keeping working families at the forefront of our agenda . https : t . co rhqfqujgwirt whitehouse : the current tax code is a burden on american taxpayers and harmful to american job creators . learn more : https : t . co w5eml rt gop : . potus : i want to work with congress republicans and democrats on a plan that is pro growth pro jobs pro worker and pro amer thank you our great honor ! https : t . co strciewuwshurricane irma is raging but we have great teams of talented and brave people already in place and ready to help . be careful be safe ! femawe want our companies to hire amp ; grow in america to raise wages for american workers amp ; to help rebuild our american cities amp ; towns ! usa https : t . co sglubjcbw4if we want to renew our prosperity restore opportunity amp ; re establish our economic dominance then we need tax reform that is pro growth . . https : t . co 9nzlg2qzpothank you for joining me in mandan nd gov . dougburgum lt . gov . brentsanfordnd senjohnhoeven repkevincramer amp ; senatorheitkamp . https : t . co 8nivthvpu6
304,8,a message to my fellow americans irmahurricane2017 https : t . co jyg6alyaab https : t . co ipujthzejr https : t . co hcq9kmkc4erepublicans must start the tax reform tax cut legislation asap . don't wait until the end of september . needed now more than ever . hurry ! . . . never allow the republicans to pass even great legislation . 8 dems control will rarely get 60 vs . 51 votes . it is a repub death wish ! republicans sorry but i've been hearing about repeal amp ; replace for 7 years didn't happen ! even worse the senate filibuster rule will . . . . our incredible u . s . coast guard saved more than 15000 lives last week with harvey . irma could be even tougher . we love our coast guard ! hurricane irma is of epic proportion perhaps bigger than we have ever seen . be safe and get out of its wayif possible . federal g is ready ! we will confront any challenge no matter how strong the winds or high the water . i m proud to stand with presidents for oneamericaappeal . i encourage everyone in the path of hurricaneirma to heed the advice and orders of local amp ; state officials ! https : t . co aqmawtpzs0
305,3,this is a storm of enormous destructive power and i ask everyone in the storm s path to heed all instructions from government officials . https : t . co njfm2sdme1florida visit https : t . co pdbad9t8sk to find shelters road closures amp ; evacuation routes . helpful twitter list : https : t . co bumvlxgfe8 https : t . co ncnuqceb5kchurches in texas should be entitled to reimbursement from fema relief funds for helping victims of hurricane harvey just like others .
306,11,rt scavino45 : hurricane force winds hit florida keys . 390 shelters have been opened in florida . shelters near you https : t . co ll5pdp0n9d rt secretarysonny : serious cabinet meeting today called by potus at camp david . reports on irma 's track potential impact fed amp ; state rt travelgov : continue to notify us of us citizens overseas impacted by hurricaneirma amp ; hurricanejose . https : t . co euiptb144z https : t rt kellyannepolls : love and prayers for friends adrienne amp ; eric bolling . may eric chase know eternal peace . https : t . co rtocsvppgyrt nypdnews : many supported nyers when sandy hit . now our ny task force 1 can be there to help others during harvey amp ; hurricaneirma . here rt seanhannity : ericbolling to my dear friend please know we all love you will be here for you and your family . rt donaldjtrumpjr : great pic from a friend on cbpflorida customsborder who have been helping with harvey recovery and now with irma . t rt scavino45 : florida governor rick flgovscott . hurricaineirma https : t . co ch3wx9hdmjrt erictrump : please stay safe florida ! you are in our thoughts and we are praying for you ! https : t . co b3998hzyhithe u . s . coast guard fema and all federal and state brave people are ready . here comes irma . god bless everyone ! heed the advice of flgovscott ! if you're in an evacuation zone you need to get to a shelter . . . there 's not many hours left . gov . scott https : t . co 92w8vinmuk
307,2,may god forever bless the united states of america . neverforget911 https : t . co erycjgj23r neverforget https : t . co rmq1a5bdon
308,5,it was a great honor to welcome prime minister najib abdul razak of malaysia and his distinguished delegation to the whitehouse today ! https : t . co 3pwrboh8dgcongratulations to eric amp ; lara on the birth of their son eric luke trump this morning ! https : t . co aw0av82xdethe devastation left by hurricane irma was far greater at least in certain locationsthan anyone thought but amazing people working hard ! fascinating to watch people writing books and major articles about me and yet they know nothing about me amp ; have zero access . fake news ! rt loudobbs : making america great again kellyannepolls : after irma potus is focused on saving lives not swamp shenanigans . dobbs ma
309,3,with irma and harvey devastation tax cuts and tax reform is needed more than ever before . go congress go ! i will be traveling to florida tomorrow to meet with our great coast guard fema and many of the brave first responders amp ; others . the approval process for the biggest tax cut amp ; tax reform package in the history of our country will soon begin . move fast congress !
310,13,we are with you florida ! emergency information 1 800 342 3557https : t . co zbwkr5vmdpvolunteer 1 800 fl help 1https : t . co ghkbvajbn0 https : t . co 2jj85weo1u . . . i told republicans to approve healthcare fast or this would happen . but don't worry i will veto because i love our country amp ; its people . bernie sanders is pushing hard for a single payer healthcare plan a curse on the u . s . amp ; its people . . . spoke to president of mexico to give condolences on terrible earthquake . unable to reach for 3 days b c of his cell phone reception at site . just left florida for d . c . the people and spirit in that great state is unbelievable . damage horrific but will be better than ever ! am leaving now for florida to see our great first responders and to thank the u . s . coast guard fema etc . a real disaster much work to do ! . . . they have been in our country for many years through no fault of their own brought in by parents at young age . plus big border securitydoes anybody really want to throw out good educated and accomplished young people who have jobs some serving in the military ? really ! . . . . . the wall which is already under construction in the form of new renovation of old and existing fences and walls will continue to be built . no deal was made last night on daca . massive border security would have to be agreed to in exchange for consent . would be subject to vote . the deplorables came back to haunt hillary . they expressed their feelings loud and clear . she spent big money but in the end had no game ! crooked hillary clinton blames everybody and every thing but herself for her election loss . she lost the debates and lost her direction ! china has a business tax rate of 15 . we should do everything possible to match them in order to win with our economy . jobs and wages !
311,14,happy 70th birthday to the usairforce ! the american people are eternally grateful . thank you for keeping america proud strong and free ! https : t . co dyxkh3gj0rwe will defend our people our nations and our civilization from all who dare to threaten our way of life . . . cont : https : t . co sybrshx89b https : t . co siiauxl3oeour hearts amp ; prayers go out to the people of london who suffered a vicious terrorist attack . . . . https : t . co q2htbv2l5tnever forget our heroes held prisoner or who have gone missing in action while serving their country . proclamation : https : t . co 4xbzgjagj5 https : t . co yztr7rlptvfrank fx giaccio on behalf of flotus melania amp ; myself thank you for doing a great job this morning ! natlparkservice gives you an a ! https : t . co 135dxuapuiweekly address https : t . co msala9poatchain migration cannot be allowed to be part of any legislation on immigration ! espn is paying a really big price for its politics and bad programming . people are dumping it in record numbers . apologize for untruth ! we have made more progress in the last nine months against isis than the obama administration has made in 8 years . must be proactive amp ; nasty ! the travel ban into the united states should be far larger tougher and more specific but stupidly that would not be politically correct ! loser terrorists must be dealt with in a much tougher manner . the internet is their main recruitment tool which we must cut off amp ; use better ! another attack in london by a loser terrorist . these are sick and demented people who were in the sights of scotland yard . must be proactive ! with the ridiculous filibuster rule in the senate republicans need 60 votes to pass legislation rather than 51 . can't get votes end now ! florida just like tx we are w you today we are w you tomorrow amp ; we will be w you every single day after to restore recover amp ; rebuild ! https : t . co phrmudujxj
312,3,i will be in huntsville alabama on saturday night to support luther strange for senate . big luther is a great guy who gets things done ! attorney general bill shuette will be a fantastic governor for the great state of michigan . i am bringing back your jobs and bill will help ! a great deal of good things happening for our country . jobs and stock market at all time highs and i believe will be getting even better !
313,15,rt realdonaldtrump : loser terrorists must be dealt with in a much tougher manner . the internet is their main recruitment tool which we must rt realdonaldtrump : the travel ban into the united states should be far larger tougher and more specific but stupidly that would not be important meetings and calls scheduled for today . military and economy are getting stronger by the day and our enemies know it . magart markets : what is trump worth to twitter ? one analyst estimates 2 billion https : t . co knnivpqr35 https : t . co djkzirk5nlmy great honor ! https : t . co x25t9tqanirt fuctupmind : realdonaldtrump donald trump 's amazing golf swing crookedhillary https : t . co vkhxxfcbv1rt team trump45 : realdonaldtrump https : t . co vu56q4z2xjrt team trump45 : realdonaldtrump https : t . co monpkukxqmrt team trump45 : realdonaldtrump https : t . co 1zo6zc2pxtrt glamourizes : realdonaldtrump only true americans can see that president trump is making america great . he 's the only person who can ! h rt team trump45 : realdonaldtrump https : t . co dw0zkytyftrt dmartosko : this is the nytimes . can you understand why so many reporters are cautious about working for them ? https : t . co lrjktfngm4thank you ! https : t . co vs4mnwxteii spoke with president moon of south korea last night . asked him how rocket man is doing . long gas lines forming in north korea . too bad ! attorney general bill schuette will be a fantastic governor for the great state of michigan . i am bringing back your jobs and bill will help
314,5,such an honor to have my good friend israel pm netanyahu join us w his delegation in nyc this afternoon . unga https : t . co yehwjdtqx8 https : t . co jwu4e8yk8alooking forward to meeting with prime minister netanyahu shortly . peace in the middle east would be a truly great legacy for all people ! we commend sg antonioguterres amp ; his call for the un to focus more on people amp ; less on bureaucracy . usaatunga unga https : t . co kvvcmznmcn https : t . co uqn6rrc9xwhappy 70th birthday cia ! https : t . co cu3gozmf7jhappy 70th birthday usairforce ! https : t . co snkxo40vxm
315,9,it was a great honor to have spoken before the countries of the world at the united nations . usaatunga ungahttps : t . co 1majwrga3d https : t . co 6hu3aeup58god bless the people of mexico city . we are with you and will be there for you . as president of the united states of america i will always put americafirst ungafull remarks : https : t . co ksamsq2lhm https : t . co xrtpawwucnthe has great strength amp ; patience but if it is forced to defend itself or its allies we will have no choice but to totally destroy noko . https : t . co p4vaanxvgmrt ivankatrump : i have long respected india 's accomplished and charismatic foreign minister sushmaswaraj and it was an honor to meet her big day at the united nations many good things and some tricky ones happening . we have a great team . big speech at 10 : 00 a . m . usaatunga unga https : t . co mjij7hg3euwe call for the full restoration of democracy and political freedoms in venezuela and we want it to happen very very soon ! https : t . co bmjdotaeslit was a great honor to be with president emmanuelmacron of france this afternoon with his delegation . great bilateral meeting ! unga https : t . co hnxddu5d5f
316,26,i would not sign graham cassidy if it did not include coverage of pre existing conditions . it does ! a great bill . repeal amp ; replace . alabama is sooo lucky to have a candidate like big luther strange . smart tough on crime borders amp ; trade loves vets amp ; military . tuesday ! on behalf of all americans i want to wish jewish families many blessings in the new year . https : t . co m4vwxyvonx https : t . co iyg1g8galnrt vp : went to the senate today to say potus amp ; i fully support graham cassidy plan to repeal replace obamacare . let 's get this done . http honored to host a luncheon for african leaders this afternoon . great discussions on the challenges amp ; opportunities facing our nations today . https : t . co abnbjtkcaihonored to meet w pres abbas from the palestinian authority amp ; his delegation who have been working hard w everybody involved toward peace . https : t . co 4e8awdkx93it was a great honor to be with king abdullah ii of jordan and his delegation this morning . we had a great bilateral meeting ! https : t . co 6tydhswka3looking forward to friday night in the great state of alabama . i am supporting big luther strange because he was so loyal amp ; helpful to me ! i hope republican senators will vote for graham cassidy and fulfill their promise to repeal amp ; replace obamacare . money direct to states ! rand paul is a friend of mine but he is such a negative force when it comes to fixing healthcare . graham cassidy bill is great ! ends ocare ! rt franklin graham : join me in praying for potus . he reminded the world if the righteous many do not confront the wicked few then evil thank you foxandfriends great show ! rt realeaglebites : realdonaldtrump it is the height of hypocrisy . obama and clinton in effect gave nuclear weapons to north korea by thei the world is noticing thanks ! https : t . co 2nl6slwnmhrt donnawr8 : realdonaldtrump thank you potus for believing in us like we believed in you ! maga https : t . co c476shwd0mafter allowing north korea to research and build nukes while secretary of state bill c also crooked hillary now criticizes . big meetings today at the united nations . so many interesting leaders . america first will make america great again ! rt scavino45 : the iran deal was one of the worst amp ; most one sided transactions the united states has ever entered into . potus realdona rt scavino45 : wethepeople usaatunga unga https : t . co 8vsfl9mzxxrt scavino45 : . potus realdonaldtrump and un secretary general antonioguterres pose for prior to their expanded bilateral meeting . usa thank you jacob ! https : t . co wjjrv6ktvti was saddened to see how bad the ratings were on the emmys last night the worst ever . smartest people of them all are the deplorables . so nice thank you ! https : t . co cg4dzhhbrva great and important day at the united nations . met with leaders of many nations who agree with much or all of what i stated in my speech ! puerto rico being hit hard by new monster hurricane . be careful our hearts are with you will be there to help ! the true question for the un . . . https : t . co tx5snacaas
317,9,a big day for the u . s . at the united nations ! senator luther strange has gone up a lot in the polls since i endorsed him a month ago . now a close runoff . he will be great in d . c . today i announced a new executive order with re : to north korea . we must all do our part to ensure the complete denuclearization of noko . https : t . co igjosm7n7hit was a great privilege to meet with president moon of south korea . stay tuned ! unga https : t . co 7xydo5ddumit was wonderful to have president petro poroshenko of ukraine with us in new york city today . unga https : t . co ukomuj0zul https : t . co gpkery8wipit was a pleasure to have president ashraf ghani of afghanistan with us this morning ! usaatunga unga https : t . co hoevfnmn14governor ricardorossello we are with you and the people of puerto rico . stay safe ! prstrongsenator doctor bill cassidy is a class act who really cares about people and their health care he doesn't lie just wants to help people ! the nra strongly endorses luther strange for senator of alabama . that means all gun owners should vote for big luther . he won't let you down !
318,11,heading to alabama now big crowd ! thank you to doug parker and american airlines for all of the help you have given to the u . s . with hurricane flights . fantastic job ! usaatunga unga https : t . co mit2lj7q90will be in alabama tonight . luther strange has gained mightily since my endorsement but will be very close . he loves alabama and so do i ! the greatest influence over our election was the fake news media screaming for crooked hillary clinton . next she was a bad candidate ! the russia hoax continues now it 's ads on facebook . what about the totally biased and dishonest media coverage in favor of crooked hillary ? rt donnawr8 : . potus trump amp ; flotus when all seemed hopeless . . . you brought hope ! you inspire us all ! maga harvey scavino45 usa rt twitterdata : these are the 10 most tweeted about world leaders during the first day of unga general debate https : t . co hhlolnakdjthank you ! https : t . co hlz48rlkifkim jong un of north korea who is obviously a madman who doesn't mind starving or killing his people will be tested like never before ! rand paul or whoever votes against hcare bill will forever future political campaigns be known as the republican who saved obamacare .
319,13,roger goodell of nfl just put out a statement trying to justify the total disrespect certain players show to our country . tell them to stand ! democrats are laughingly saying that mccain had a moment of courage . tell that to the people of arizona who were deceived . 116 increase ! iran just test fired a ballistic missile capable of reaching israel . they are also working with north korea . not much of an agreement we have ! very proud of our incredible first lady flotus . she is a truly great representative for our country ! https : t . co yfv0wijgby . . . our great american flag or country and should stand for the national anthem . if not you're fired . find something else to do ! if a player wants the privilege of making millions of dollars in the nflor other leagues he or she should not be allowed to disrespect . . . . going to the white house is considered a great honor for a championship team . stephen curry is hesitatingtherefore invitation is withdrawn ! it was great being with luther strange last night in alabama . what great people what a crowd ! vote luther on tuesday . alaska had a 200 plus increase in premiums under obamacare worst in the country . deductibles high people angry ! lisa m comes through . i know rand paul and i think he may find a way to get there for the good of the party ! large block grants to states is a good thing to do . better control amp ; management . great for arizona . mccain let his best friend l . g . down ! arizona had a 116 increase in obamacare premiums last year with deductibles very high . chuck schumer sold john mccain a bill of goods . sadjohn mccain never had any intention of voting for this bill which his governor loves . he campaigned on repeal amp ; replace . let arizona down !
320,11,making america safe is my number one priority . we will not admit those into our country we cannot safely vet . https : t . co kj886okyfcsports fans should never condone players that do not stand proud for their national anthem or their country . nfl should change policy ! alaska arizona maine and kentucky are big winners in the healthcare proposal . 7 years of repeal amp ; replace and some senators not there . courageous patriots have fought and died for our great american flag we must honor and respect it ! make america great again ! rt donnawr8 : realdonaldtrump i wonder what this brave american would give to stand on his own two legs just once more for our anthem ? rt donnawr8 : realdonaldtrump you can boycott our anthem we can boycott you ! nfl maga https : t . co ryyzznxjxeplease to inform that the champion pittsburgh penguins of the nhl will be joining me at the white house for ceremony . great team ! great solidarity for our national anthem and for our country . standing with locked arms is good kneeling is not acceptable . bad ratings ! . . . nfl attendance and ratings are way down . boring games yes but many stay away because they love our country . league should back u . s . if nfl fans refuse to go to games until players stop disrespecting our flag amp ; country you will see change take place fast . fire or suspend ! just heard foreign minister of north korea speak at u . n . if he echoes thoughts of little rocket man they won't be around much longer !
