date_idx,num_tweets,text
396,14,great army navy game . army wins 14 to 13 and brings home the commander in chief s trophy ! congratulations ! great army navy game . army wins 14 to 13 and brings home the commander in chief s trophy last time was 1996 . wow ! congratulations ! . daveweigel of the washington post just admitted that his picture was a fake fraud ? showing an almost empty arena last night for my speech in pensacola when in fact he knew the arena was packed as shown also on t . v . . fake news he should be fired . . daveweigel washingtonpost put out a phony photo of an empty arena hours before i arrived the venue w thousands of people outside on their way in . real photos now shown as i spoke . packed house many people unable to get in . demand apology amp ; retraction from fake news wapo ! https : t . co xablfgh1obhave a great game today usarmy and usnavy i will be watching . we love our u . s . military . on behalf of an entire nation thank you for your sacrifice and service ! armynavygame usa https : t . co 8m1w9rfwihit was my great honor to celebrate the opening of two extraordinary museums the mississippi state history museum amp ; the mississippi civil rights museum . we pay solemn tribute to our heroes of the past amp ; dedicate ourselves to building a future of freedom equality justice amp ; peace . https : t . co 5akgvpv8aaheading to the great state of mississippi at the invitation of their popular and respected governor philbryantms . look forward to seeing the new civil rights museum ! cnn s slogan is cnn the most trusted name in news . everyone knows this is not true that this could in fact be a fraud on the american public . there are many outlets that are far more trusted than fake news cnn . their slogan should be cnn the least trusted name in news ! fake news cnn made a vicious and purposeful mistake yesterday . they were caught red handed just like lonely brian ross at abc news who should be immediately fired for his mistake . watch to see if cnn fires those responsible or was it just gross incompetence ? a big contingent of very enthusiastic roy moore fans at the rally last night . we can t have a pelosi schumer liberal democrat jones in that important alabama senate seat . need your vote to make america great again ! jones will always vote against what we must do for our country . great evening last night in pensacola florida . arena was packed to the rafters the crowd was loud loving and really smart . they definitely get what s going on . thank you pensacola ! we believe that every american should stand for the national anthem and we proudly pledge allegiance to one nation under god ! https : t . co r2ittwwfvsthis is your land this is your home and it 's your voice that matters the most . so speak up be heard and fight fight fight for the change you've been waiting for your entire life ! merry christmas and thank you pensacola florida ! https : t . co gewgzpzrp6just arrived at the pensacola bay center . join me live on foxnews in 10 minutes ! maga https : t . co rqfqokcpnv
397,4,very little discussion of all the purposely false and defamatory stories put out this week by the fake news media . they are out of control correct reporting means nothing to them . major lies written then forced to be withdrawn after they are exposed . . . a stain on america ! getting closer and closer on the tax cut bill . shaping up even better than projected . house and senate working very hard and smart . end result will be not only important but special ! things are going really well for our economy a subject the fake news spends as little time as possible discussing ! stock market hit another record high unemployment is now at a 17 year low and companies are coming back into the usa . really good news and much more to come ! no american should be separated from their loved ones because of preventable crime committed by those illegally in our country . our cities should be sanctuaries for americans not for criminal aliens ! https : t . co cvtkcg1pln
398,1,another false story this time in the failing nytimes that i watch 4 8 hours of television a day wrong ! also i seldom if ever watch cnn or msnbc both of which i consider fake news . i never watch don lemon who i once called the dumbest man on television ! bad reporting .
399,5,wishing all of those celebrating hanukkah around the world a happy and healthy eight nights in the company of those they love . https : t . co a5w0pdwbxp https : t . co d9mvvpq39xconsumer confidence is at an all time high along with a record high stock market . unemployment is at a 17 year low . make america great again ! working to pass massive tax cuts looking good . the people of alabama will do the right thing . doug jones is pro abortion weak on crime military and illegal immigration bad for gun owners and veterans and against the wall . jones is a pelosi schumer puppet . roy moore will always vote with us . vote roy moore ! lightweight senator kirsten gillibrand a total flunky for chuck schumer and someone who would come to my office begging for campaign contributions not so long ago and would do anything for them is now in the ring fighting against trump . very disloyal to bill amp ; crooked used ! despite thousands of hours wasted and many millions of dollars spent the democrats have been unable to show any collusion with russia so now they are moving on to the false accusations and fabricated stories of women who i don t know and or have never met . fake news !
400,5,thank you omarosa for your service ! i wish you continued success . if last night s election proved anything it proved that we need to put up great republican candidates to increase the razor thin margins in both the house and senate . wow more than 90 of fake news media coverage of me is negative with numerous forced retractions of untrue stories . hence my use of social media the only way to get the truth out . much of mainstream meadia has become a joke ! foxandfriendsthe reason i originally endorsed luther strange and his numbers went up mightily is that i said roy moore will not be able to win the general election . i was right ! roy worked hard but the deck was stacked against him ! congratulations to doug jones on a hard fought victory . the write in votes played a very big factor but a win is a win . the people of alabama are great and the republicans will have another shot at this seat in a very short period of time . it never ends !
401,7,rt gopchairwoman : . realdonaldtrump is the paycheck president . learn how the tax bill will put more money in your pocket amp ; how to contact manufacturing optimism rose to another all time high in the latest shopfloornam outlook survey https : t . co luv4bmp0xcin 1960 there were approximately 20000 pages in the code of federal regulations . today there are over 185000 pages as seen in the roosevelt room . today we cut the red tape ! it is time to set free our dreams and make america great again ! https : t . co teavnzjvcxwhen americans are free to thrive innovate amp ; prosper there is no challenge too great no task too large amp ; no goal beyond our reach . we are a nation of explorers pioneers innovators amp ; inventors . we are nation of people who work hard dream big amp ; who never ever give up . . . https : t . co 9lvdp6zogztoday we gathered in the roosevelt room for one single reason : to cut the red tape ! for many decades an ever growing maze of regs rules and restrictions has cost our country trillions of dollars millions of jobs countless american factories amp ; devastated entire industries . https : t . co ostxovnckfas a candidate i promised we would pass a massive tax cut for the everyday working americans . if you make your voices heard this moment will be forever remembered as a great new beginning the dawn of a brilliant american future shining with patriotism prosperity and pride ! https : t . co exsbzrlcdwrepublican tax cuts are looking very good . all are working hard . in the meantime the stock market hit another record high !
402,4,today it was my tremendous honor to visit marine helicopter squadron one hmx 1 at the marine corps air facility in quantico virginia . i am honored to serve as your commander in chief . on behalf of an entire nation thank you for your sacrifice and service . we love you ! https : t . co elotc7do52you are always there for us the men and women in blue . thank you to our police thank you to our sheriffs and thank you to our law enforcement families . god bless you all and god bless america ! lesm https : t . co 9ejiddvl9hto each member of the graduating class from the national academy at quantico congratulations ! https : t . co bgt8s33zluit was my honor . thank you ! https : t . co 1lvqbrq1bi
403,8,weekly address https : t . co 1sh20hb33xtax cuts will increase investment in the american economy and in u . s . workers leading to higher growth higher wages and more jobs ! https : t . co 4gxm8psmu1congratulations to two great and hardworking guys corey lewandowski and david bossie on the success of their just out book let trump be trump . finally people with real knowledge are writing about our wonderful and exciting campaign ! great job kevin we are all proud of you ! https : t . co k6heeaoxktrt repkristinoem : a lot of tough decisions got us to this point but we re closer than we ve been in 30 years to a fairer tax code that k rt speakerryan : for individuals and families the final tax cuts amp ; jobs act : lowers individual taxes nearly doubles the standard deducti rt presssec : . potus historic tax cuts doubling of the child tax credit will do infinitely more to empower working moms than liberals ' p dow s amp ; p 500 and nasdaq close at record highs ! maga https : t . co hvqwnqsgug
404,2,wonderful weekend at camp david . a very special place . a lot of very important work done . heading back to the whitehouse now . https : t . co ckxlsdr1utas a candidate i promised we would pass a massive tax cut for the everyday working american families who are the backbone and the heartbeat of our country . now we are just days away . . . https : t . co madtgumktx
405,13,with the strategy that i announced today we are declaring that america is in the game and america is determined to win ! our four pillars of national security strategy : https : t . co b3poamvid870 record closes for the dow so far this year ! we have never had 70 dow records in a one year period . wow ! thank you maria b ! https : t . co v1ur63cqlkso true ivanka ! https : t . co bngujg69kias the world watches we are days away from passing historic tax cuts for american families and businesses . it will be the biggest tax cut and tax reform in the history of our country ! https : t . co evcakjuf8wwhen the american people speak all of us should listen . just over one year ago you spoke loud and clear . on november 8 2016 you voted to make america great again ! https : t . co 3aov53s0puover the past 11 months i have travelled tens of thousands of miles to visit 13 countries . i have met with more than 100 world leaders and everywhere i traveled it was my highest privilege and greatest honor to represent the american people ! https : t . co 7sdseeihjhour deepest sympathies and most heartfelt prayers are with the victims of the train derailment in washington state . we are closely monitoring the situation and coordinating with local authorities . . . https : t . co gyf5bdvm4gmy thoughts and prayers are with everyone involved in the train accident in dupont washington . thank you to all of our wonderful first responders who are on the scene . we are currently monitoring here at the white house . the train accident that just occurred in dupont wa shows more than ever why our soon to be submitted infrastructure plan must be approved quickly . seven trillion dollars spent in the middle east while our roads bridges tunnels railways and more crumble ! not for long ! ivanka trump will be interviewed on foxandfriends . remember republicans are 5 0 in congressional races this year . the media refuses to mention this . i said gillespie and moore would lose for very different reasons and they did . i also predicted i would win . republicans will do well in 2018 very well ! foxandfriendsmore than a century after conquering flight the wrightbrothers continue to motivate amp ; inspire americans who never tire of exploration amp ; innovation . this great american spirit can be found in the design of every new supersonic jet and next generation : https : t . co nekpmgkdg8 https : t . co podjl00lay
406,5,congratulations to paul ryan kevin mccarthy kevin brady steve scalise cathy mcmorris rodgers and all great house republicans who voted in favor of cutting your taxes ! a story in the washingtonpost that i was close to rescinding the nomination of justice gorsuch prior to confirmation is fake news . i never even wavered and am very proud of him and the job he is doing as a justice of the u . s . supreme court . the unnamed sources don t exist ! stocks and the economy have a long way to go after the tax cut bill is totally understood and appreciated in scope and size . immediate expensing will have a big impact . biggest tax cuts and reform ever passed . enjoy and create many beautiful jobs ! dow rises 5000 points on the year for the first time ever make america great again ! together our task is to strengthen our families to build up our communities to serve our citizens and to celebrate american greatness as a shining example to the world . . . . https : t . co ds6tzlgjpa
407,6,we are making america great again ! https : t . co hy353gxv0rwe are delivering historic tax relief for the american people ! taxcutsandjobsact https : t . co llgatrch5otogether we are making america great again ! https : t . co 47k9i4p3j2i would like to congratulate senatemajldr on having done a fantastic job both strategically amp ; politically on the passing in the senate of the massive tax cut amp ; reform bill . i could have not asked for a better or more talented partner . our team will go onto many more victories ! the tax cuts are so large and so meaningful and yet the fake news is working overtime to follow the lead of their friends the defeated dems and only demean . this is truly a case where the results will speak for themselves starting very soon . jobs jobs jobs ! the united states senate just passed the biggest in history tax cut and reform bill . terrible individual mandate obamacare repealed . goes to the house tomorrow morning for final vote . if approved there will be a news conference at the white house at approximately 1 : 00 p . m .
408,5,thank you to everyone who joined me at the whitehouse yesterday . together we are making america great again ! https : t . co 9hgcbkdsxo https : t . co dtmu8owmwbhouse democrats want a shutdown for the holidays in order to distract from the very popular just passed tax cuts . house republicans don t let this happen . pass the c . r . today and keep our government open ! home sales hit best numbers in 10 years ! make america great againwas foxandfriends just named the most influential show in news ? you deserve it three great people ! the many fake news hate shows should study your formula for success ! the massive tax cuts which the fake news media is desperate to write badly about so as to please their democrat bosses will soon be kicking in and will speak for themselves . companies are already making big payments to workers . dems want to raise taxes hate these big cuts !
409,11,remember the most hated part of obamacare is the individual mandate which is being terminated under our just signed tax cut bill . today it was my great honor to sign the largest tax cuts and reform in the history of our country . full remarks : https : t . co kmxoxeb68g https : t . co oeaoa0slfxthe united nations security council just voted 15 0 in favor of additional sanctions on north korea . the world wants peace not death ! congressman ron desantis is a brilliant young leader yale and then harvard law who would make a great governor of florida . he loves our country and is a true fighter ! 95 of americans will pay less or at worst the same amount of taxes mostly far less . the dems only want to raise your taxes ! will be signing the biggest ever tax cut and reform bill in 30 minutes in oval office . will also be signing a much needed 4 billion dollar missile defense bill . with all my administration has done on legislative approvals broke harry truman s record regulation cutting judicial appointments building military va tax cuts amp ; reform record economy stock market and so much more i am sure great credit will be given by mainstream news ? the president has accomplished some absolutely historic things during this past year . thank you charlie kirk of turning points usa . sadly the fake mainstream media will never talk about our accomplishments in their end of year reviews . we are compiling a long amp ; beautiful list . at some point and for the good of the country i predict we will start working with the democrats in a bipartisan fashion . infrastructure would be a perfect place to start . after having foolishly spent 7 trillion in the middle east it is time to start rebuilding our country ! so true ! https : t . co 1c8hu6o5t9our big and very popular tax cut and reform bill has taken on an unexpected new source of love that is big companies and corporations showering their workers with bonuses . this is a phenomenon that nobody even thought of and now it is the rage . merry christmas !
410,6,remember the republicans are 5 0 in congressional races this year . in senate i said roy m would lose in alabama and supported big luther strange and roy lost . virginia candidate was not a trumper and he lost . good republican candidates will win big ! the stock market is setting record after record and unemployment is at a 17 year low . so many things accomplished by the trump administration perhaps more than any other president in first year . sadly will never be reported correctly by the fake news media ! wow fbi lawyer james baker reassigned according to foxnews . fbi deputy director andrew mccabe is racing the clock to retire with full benefits . 90 days to go ? ! ! ! how can fbi deputy director andrew mccabe the man in charge along with leakin james comey of the phony hillary clinton investigation including her 33000 illegally deleted emails be given 700000 for wife s campaign by clinton puppets during investigation ? rt erictrump : journalismisdead https : t . co xzajd5adb7
411,4,the tax cut reform bill including massive alaska drilling and the repeal of the highly unpopular individual mandate brought it all together as to what an incredible year we had . don t let the fake news convince you otherwise . . . and our insider polls are strong ! the fake news refuses to talk about how big and how strong our base is . they show fake polls just like they report fake news . despite only negative reporting we are doing well nobody is going to beat us . make america great again ! rt shawgerald4 : realdonaldtrump thank you president trump ! ! https : t . co lkdkt0fl99 . foxnews fbi s andrew mccabe in addition to his wife getting all of this money from m clinton puppet he was using allegedly his fbi official email account to promote her campaign . you obviously cannot do this . these were the people who were investigating hillary clinton .
412,5,i hope everyone is having a great christmas then tomorrow it s back to work in order to make america great again which is happening faster than anyone anticipated ! rt erictrump : we should all take a moment to say a prayer for those who paid the ultimate price their bravery and sacrifice allows us t merry christmas ! ! ! https : t . co mytv5gndllmerry christmas ! ! https : t . co xa2qxcisvvpeople are proud to be saying merry christmas again . i am proud to have led the charge against the assault of our cherished and beautiful phrase . merry christmas ! ! ! ! !
413,3,all signs are that business is looking really good for next year only to be helped further by our tax cut bill . will be a great year for companies and jobs ! stock market is poised for another year of success ! wow foxandfrlends dossier is bogus . clinton campaign dnc funded dossier . fbi cannot after all of this time verify claims in dossier of russia trump collusion . fbi tainted . and they used this crooked hillary pile of garbage as the basis for going after the trump campaign ! based on the fact that the very unfair and unpopular individual mandate has been terminated as part of our tax cut bill which essentially repeals over time obamacare the democrats amp ; republicans will eventually come together and develop a great new healthcare plan !
414,2,just left west palm beach fire amp ; rescue 2 . met with great men and women as representatives of those who do so much for all of us . firefighters paramedics first responders what amazing people they are ! on 1 20 the day trump was inaugurated an estimated 35000 isis fighters held approx 17500 square miles of territory in both iraq and syria . as of 12 21 the u . s . military estimates the remaining 1000 or so fighters occupy roughly 1900 square miles . . . via jamiejmcintyre https : t . co 0lxkmuope9
415,11,together we are making america great again ! https : t . co oeytdfyl1q https : t . co wdlqkfdy4mrt realdonaldtrump : arrests of ms 13 members associates up 83 under trump https : t . co 70iphy2yqnrt danscavino : congratulations to the 2017 pinstripebowl yankee stadium champions iowa hawkeyefootball ! https : t . co nlawu6bkmhrt erictrump : throwbackthursdays realdonaldtrump https : t . co z44iobgz7vrt ivankatrump : the trump economy is booming . one thing realdonaldtrump has done that has received little attention despite arguably d i've been saying it for a long long time . noko https : t . co lql7tghmdocaught red handed very disappointed that china is allowing oil to go into north korea . there will never be a friendly solution to the north korea problem if this continues to happen ! retail sales are at record numbers . we ve got the economy going better than anyone ever dreamt and you haven t seen anything yet ! vanity fair which looks like it is on its last legs is bending over backwards in apologizing for the minor hit they took at crooked h . anna wintour who was all set to be amb to court of st james s amp ; a big fundraiser for ch is beside herself in grief amp ; begging for forgiveness ! arrests of ms 13 members associates up 83 under trump https : t . co 70iphy2yqn on 1 20 the day trump was inaugurated an estimated 35000 isis fighters held approx 17500 square miles of territory in both iraq and syria . as of 12 21 the u . s . military est the remaining 1000 or so fighters occupy roughly 1900 square miles . . jamiejmcintyre dcexaminer https : t . co ogyeudgzd2
416,8,the democrats have been told and fully understand that there can be no daca without the desperately needed wall at the southern border and an end to the horrible chain migration amp ; ridiculous lottery system of immigration etc . we must protect our country at all cost ! why is the united states post office which is losing many billions of dollars a year while charging amazon and others so little to deliver their packages making amazon richer and the post office dumber and poorer ? should be charging much more ! rt charliekirk11 : incredible video : cbs does a special on the gop tax plan the result ? every middle class family they sat down with sa rt charliekirk11 : isis getting slaughtered : square miles liberated from isistrump : 26000 obama : 13200total square miles held by rt foxbusiness : . charliekirk11 : what this president has done is truly historic and if a democrat president achieved 1 10th of what pot rt charliekirk11 : 3 big wins in 2017 you won't hear : trump confirmed the most circuit court judges ever in a president 's 1st year all co while the fake news loves to talk about my so called low approval rating foxandfriends just showed that my rating on dec . 28 2017 was approximately the same as president obama on dec . 28 2009 which was 47 . . . and this despite massive negative trump coverage amp ; russia hoax ! in the east it could be the coldest new year s eve on record . perhaps we could use a little bit of that good old global warming that our country but not other countries was going to pay trillions of dollars to protect against . bundle up !
417,6,jobs are kicking in and companies are coming back to the u . s . unnecessary regulations and high taxes are being dramatically cut and it will only get better . much more to come ! i use social media not because i like to but because it is the only way to fight a very dishonest and unfair press now often referred to as fake news media . phony and non existent sources are being used more often than ever . many stories amp ; reports a pure fiction ! on taxes : this is the biggest corporate rate cut ever going back to the corporate income tax rate of roughly 80 years ago . this is a huge pro growth stimulus for the economy . every year the obama wh overstated how the economy would grow . now real economics and jobs . wsj reportoppressive regimes cannot endure forever and the day will come when the iranian people will face a choice . the world is watching ! https : t . co kvv1uaqcz9the entire world understands that the good people of iran want change and other than the vast military power of the united states that iran s people are what their leaders fear the most . . . . https : t . co w8rkn9b6rtmany reports of peaceful protests by iranian citizens fed up with regime s corruption amp ; its squandering of the nation s wealth to fund terrorism abroad . iranian govt should respect their people s rights including right to express themselves . the world is watching ! iranprotests
